text,font_size,bold,page,x,y,is_upper,is_title_case,is_numbered,label
THE CENTRE FOR HUMANITARIAN DATA1AUGUST 2019,8.0,False,1,53.44820022583008,791.611328125,True,False,False,body
WHAT IS A DATA INCIDENT IN HUMANITARIAN RESPONSE?,11.0,True,1,53.9370002746582,425.33489990234375,True,False,False,H1
"In the humanitarian sector, data incidents are events involving the management of data that have caused harm or have the potential to cause harm to crisis affected populations, humanitarian organisations and their operations, and other individuals or groups. These events can exploit or exacerbate existing vulnerabilities.1 In some cases, they may also create new vulnerabilities that can increase the risk of future data incidents.",10.34,False,1,53.85760498046875,450.0188903808594,False,False,False,body
"Humanitarians have not had a common understanding of what comprises a data incident, nor is there a minimum technical standard for how these incidents should be prevented and managed. How the humanitarian sector develops tools and implements procedures for data incident management will play a significant role in the evolution of the ethical, human rights, technical, and professional standards of humanitarian operations.",11.0,False,1,53.85760498046875,529.2227172851562,False,False,False,body
"1     “A vulnerability is a weakness in an information system, system security procedures, internal controls, or implementation that could be exploited by     a threat source.” NIST Special Publication 800-30 Revision 1, Guide for Conducting Risk Assessments.",7.07,False,1,53.858299255371094,758.9194946289062,False,False,True,body
THE CENTRE FOR HUMANITARIAN DATA,14.0,True,1,53.95610046386719,55.29532241821289,True,False,False,body
GUIDANCE NOTE SERIESDATA RESPONSIBILITY IN HUMANITARIAN ACTION,12.0,True,1,53.309600830078125,98.43220520019531,True,False,False,body
DATA INCIDENT MANAGEMENT,19.0,True,1,53.309600830078125,138.70919799804688,True,False,False,body
KEY TAKEAWAYS:,11.0,True,1,63.71649932861328,199.99630737304688,True,False,False,body
"•	 Humanitarian data incidents are events involving the management of data that have caused harm or have the potential to cause harm to crisis-affected people, organizations and their operations, and other individuals or groups.",11.0,False,1,74.98049926757812,222.6892852783203,False,False,False,body
"•	 Examples of humanitarian data incidents include physical breaches of infrastructure, unauthorised disclosure of data, and the use of beneficiary data for non-humanitarian purposes, among others.",11.0,False,1,74.98049926757812,273.289306640625,False,False,False,body
"•	 A data incident has four aspects: (i) a threat source, (ii) a threat event, (iii) a vulnerability and (iv) an adverse impact.",11.0,False,1,74.98049926757812,323.88934326171875,False,False,False,body
"•	 There are five steps to responding to data incidents: (i) notification, (ii) classification, (iii) treatment, and (iv) closure of the incident, as well as (v) learning.",11.0,False,1,74.98049926757812,361.28936767578125,False,False,False,body
"“If aid actors digitize more of their data and communications, they urgently    need to increase their digital security efforts. Though some actors are    developing promising protective tools, aid organizations overall might be   well advised to listen to a quote from IT-security circles: ‘There are two   types of organizations: those who have been hacked, and those who will be.”",11.0,False,1,109.88349914550781,615.7413940429688,False,False,False,body
"- Rahel Dette, Do No Digital Harm: Mitigating Technology Risk in Humanitarian Contexts",9.0,False,1,109.88189697265625,697.5967407226562,False,False,False,body
THE CENTRE FOR HUMANITARIAN DATA2AUGUST 2019,8.0,False,2,53.44820022583008,791.611328125,True,False,False,body
DEFINITIONS AND FRAMEWORKS FOR UNDERSTANDING DATA INCIDENTS,11.0,True,2,52.9370002746582,146.53298950195312,True,False,False,H1
Governments and the private sector have developed definitions and frameworks for understanding data incidents that serve as helpful references for the humanitarian sector.,11.0,False,2,53.861000061035156,171.2169952392578,False,False,False,body
•	 The International Organization for Standardization’s (ISO) in ISO Standard 27000 defines a ‘critical incident’ as “a single or a series of unwanted or unexpected information security events that have a significant probability of compromising business operations and threatening information security.”2,10.24,False,2,65.2020034790039,210.81703186035156,False,False,False,body
•	 The United States Department of Commerce National Institute for Standards and Technology (NIST) defines an adverse event involving a ‘cyber threat’ as “[a]n event or condition that has the potential for causing asset loss and the undesirable consequences or impact from such loss.”3,9.85,False,2,65.1968994140625,263.62078857421875,False,False,False,body
"•	 Mahmood Sher-Jan of the International Association of Privacy Professionals (IAPP) identifies three additional categories of events that expand upon the NIST definition of adverse events. These are, in order of escalating severity: security incidents; privacy incidents; and data breaches.4",9.85,False,2,65.1968994140625,316.4207763671875,False,False,False,body
"2     International Organization for Standardization, ISO/IEC 27000:2018.",6.51,False,2,53.5275993347168,732.3084106445312,False,False,True,body
3     NIST Computer Security Resource Center Glossary.,6.51,False,2,53.5275993347168,744.3084106445312,False,False,True,body
"4     IAPP, Is It an Incident or a Breach, How to Tell and Why It Matters, Mahmoud Sher-Jan (February 2017).",6.51,False,2,53.5275993347168,756.3084106445312,False,False,True,body
"5     NIST Special Publication 800-30 Revision 1, Guide for Conducting Risk Assessments.",6.51,False,2,53.5275993347168,768.3084106445312,False,False,True,body
"Humanitarian data incidents may include physical breaches of infrastructure, unauthorised disclosure of data, and the use of ‘anonymised’ beneficiary data for non-humanitarian purposes, among others. Data incidents can also occur without technical infrastructure being compromised in any way. The legitimate collection, use, and sharing of data by humanitarians can still have operational implications that may constitute a data incident in cases where rumors, cultural sensitivities, political dynamics, and other factors lead to adverse effects linked to the data.",11.0,False,2,53.614200592041016,45.47944259643555,False,False,False,body
Examples of possible humanitarian data incidents,11.0,False,2,65.1968002319336,388.2806091308594,False,False,False,body
"A data incident has four factors: a threat source, a threat event, a vulnerability and an adverse impact.5 Below are two types of hypothetical data incidents that could occur in humanitarian contexts.",9.85,False,2,65.1968002319336,419.19061279296875,False,False,False,body
The first scenario is a typical data breach incident situated in the context of an armed conflict. The second is an example of the type of vulnerabilities that can initiate data incidents unique to the humanitarian sector.,11.0,False,2,65.1983642578125,458.79461669921875,False,False,False,body
1.	Unauthorized access to data occurs [impact] due to armed actors [source] raiding a facility and seizing hard-drives containing beneficiary data [event]. The hard-drives were unencrypted [vulnerability].,11.0,True,2,76.53936767578125,511.1436767578125,False,False,True,body
"2.	Absence of guidance limiting data collection for a specific purpose [vulnerability] leads to staffcollecting data about the marital status of pregnant women [source]. A data breach [event] lateroccurs, resulting in an increased chance of physical violence [impact] against unwed pregnantbeneficiaries.",11.0,True,2,76.53936767578125,563.9436645507812,False,False,True,body
These scenarios demonstrate how to think about identifying causal chains that may create context-specific data incidents.,11.0,False,2,65.19837188720703,630.3946533203125,False,False,False,body
THE CENTRE FOR HUMANITARIAN DATA3AUGUST 2019,8.0,False,3,53.44820022583008,791.611328125,True,False,False,body
"6    NIST Special Publication 800-30 Revision 1, Guide for Conducting Risk Assessments.",6.51,False,3,53.858299255371094,767.7886962890625,False,False,True,body
RISK MODELS,11.0,True,3,52.9370002746582,44.24039077758789,True,False,False,H1
"The figure below presents a generic risk model with risk factors that organizations can use to understand how a data incident may occur. A threat event exploits an existing vulnerability that is either magnified by predisposing conditions or mitigated by security controls already in place. This causes adverse impacts that produce organizational risk, which can include risks for the organization and for affected people.",11.0,False,3,53.861000061035156,68.92438507080078,False,False,False,body
Figure 1. “Generic Risk Model with Key Risk Factors”. Source: NIST Special Publication 800-30 pg. 126,7.94,False,3,138.89759826660156,318.6869812011719,False,False,False,body
The figure below presents one example of how this generic risk model could be adapted to the humanitarian sector.,11.0,False,3,53.858299255371094,361.46051025390625,False,False,False,body
Figure 2. Risk Model with Key Risk Factors adapted to a humanitarian context.,9.0,False,3,153.12969970703125,742.2422485351562,False,False,False,body
THE CENTRE FOR HUMANITARIAN DATA4AUGUST 2019,8.0,False,4,53.44820022583008,791.611328125,True,False,False,body
Humanitarian organizations can develop their own specific risk models for data incident management incorporating these factors. The nature of these risk factors and how they come together to constitute a data incident will vary from one organization to another and should be adapted to specific operational realities.,11.0,False,4,53.858299255371094,45.18488693237305,False,False,False,body
STEPS IN DATA INCIDENT MANAGEMENT,11.0,True,4,53.50629806518555,120.14993286132812,True,False,False,H1
"After clearly defining what constitutes a data incident, organizations can develop Standard Operating Procedures (SOPs) for data incident management.",11.0,False,4,53.429298400878906,144.8339385986328,False,False,False,body
"Data incident management SOPs should include the following 5 steps: 1) notification,  2) classification; 3) treatment;  4) closure; and 5) knowledge base.7",9.47,False,4,53.429298400878906,184.43397521972656,False,False,False,body
7    The Centre for Humanitarian Data provides several sources of guidance that can inform the development of Data Incident Management SOPs on      the Data Responsibility page.,6.9,False,4,53.858299255371094,714.40625,False,False,True,body
"8    How to handle incidents according to ISO 27001 A.16, Antonio Jose Segovia, (October 2015.).",6.75,False,4,53.858299255371094,735.3162231445312,False,False,True,body
"9    For humanitarian organizations, an example of such a classification is the World Health Organization’s (WHO) International Classification of      Patient Safety, Conceptual Framework for the International Classification of Patient Safety.",6.9,False,4,53.85459899902344,747.3162231445312,False,False,True,body
"10 WHO, Conceptual Framework for the International Classification of Patient Safety.",6.75,False,4,53.858299255371094,768.3162231445312,False,False,True,body
"Figure 3: Five steps in the treatment of security incidents (Source: How to handle incidents according to ISO 27001 A.16, Antonio Jose Segovia8",8.21,False,4,71.70079803466797,282.2508239746094,False,False,False,body
The application of these steps in an organization can look as follows:,11.0,False,4,53.960601806640625,322.55499267578125,False,False,False,body
"1.	Notification of the incident: A person detects an incident and notifies relevant colleagues according to the communication procedures of the organization (usually an email, a phone call, a software tool, etc.). A notification should contain, if possible, a description of the key risk factors involved in the incident: source, event, vulnerability and impact.",11.0,True,4,65.30160522460938,346.30401611328125,False,False,True,body
"2.	Classification of the incident: The recipient of the notification classifies the incident based on it’s impact (high, medium or low) and the urgency of treatment (high, medium or low).9 Managing risk begins with classifying all incidents, whether or not tangible harm actually results from them.10",9.69,True,4,65.30160522460938,412.3040466308594,False,False,True,body
3.	Treatment of the incident: A technical expert decides on the necessary measures to treat the incident once the incident has been classified and the time for treatment has been agreed.,11.0,True,4,65.29920196533203,465.10400390625,False,False,True,body
4.	Closure of the incident: All information generated during the treatment is recorded and the person who first sent notification of the incident is informed that the incident is closed.,11.0,True,4,65.29920196533203,504.7039794921875,False,False,True,body
5.	Knowledge base: All information generated during the treatment of the incident is used to inform and train colleagues and as reference material for future similar incidents.,11.0,True,4,65.29920196533203,544.3040161132812,False,False,True,body
"Humanitarian organizations can base their SOPs on this 5-step model, describing how each step should take place within their organization. This should include the functions/roles and teams within an organization that are responsible at each stage of the process. These steps should be incorporated into or extended from existing incident response protocols (e.g. security incident management related to humanitarian access).",11.0,False,4,53.95820617675781,584.3550415039062,False,False,False,body
"In a given response context, organizations should also work to integrate any joint incident management procedures into existing coordination structures, such as the clusters and mechanisms for inter- and intra-cluster coordination.",11.0,False,4,53.95820617675781,663.5549926757812,False,False,False,body
THE CENTRE FOR HUMANITARIAN DATA5AUGUST 2019,8.0,False,5,53.44820022583008,791.611328125,True,False,False,body
RECOMMENDATIONS FOR IMPROVING DATA INCIDENT MANAGEMENT IN HUMANITARIAN ORGANIZATIONS,11.0,True,5,53.425201416015625,44.82309341430664,True,False,False,H1
Introducing or improving data incident management in humanitarian operations is critical to more responsible data practice in the sector. The Centre for Humanitarian Data recommends that organizations focus on the following areas:,11.0,False,5,53.348201751708984,83.51007843017578,False,False,False,body
"1.	Establish a common understanding of data incident managementUse a risk model to understand the causal chain that can lead to data incidents for specific offices and systems. Identify key threat actors and vulnerabilities for offices and systems and understand existing security controls and their effectiveness. Finally, map existing data incident management capacity and determine whether it is positioned appropriately. Once clear definitions and processes are articulated, invest in staff awareness and support a culture of open dialogue about incidents, in which proactive reporting and management of incidents is incentivized, not punished.",11.0,True,5,64.68920135498047,135.859130859375,False,False,True,body
"2.	Strengthen data incident management capacityTake measures to put in place security controls to mitigate the risk of data incidents, and share best practice with partners. Build on existing work in the sector to fill governance gaps which can create vulnerabilities for your organization. Engage with organizational partners to set up information channels around data incidents. Share known vulnerabilities in a controlled manner with trusted counterparts for cross-organizational learning.",11.0,True,5,64.68920135498047,241.459228515625,False,False,True,body
"3.	Support continuous learningSupport learning and development of improved data incident management practices by organizing training and drills based on scenarios likely to occur in different operational settings. These exercises should occur regularly and may even involve multiple organizations training and drilling together. In addition, document actual data incidents as cases for internal knowledge development.",11.0,True,5,64.689208984375,333.8592834472656,False,False,True,body
Organizations are encouraged to share their experience in the development of data incident management with the Centre for Humanitarian Data via centrehumdata@un.org.,11.0,False,5,53.34821319580078,413.51031494140625,False,False,False,body
This project is co-funded by the European Union,7.65,False,5,53.858299255371094,742.9628295898438,False,False,False,body
"This document covers humanitarian aid activities implemented with the financial assistance of the European Union. The views expressed herein should not be taken, in any way, to reflect the official opinion of the European Union, and the European Commission is not responsible for any use that may be made of the information it contains.",9.0,False,5,145.4882049560547,683.1764526367188,False,False,False,body
"COLLABORATORS: YALE UNIVERSITY, JACKSON INSTITUTE OF GLOBAL AFFAIRS.",10.0,False,5,53.393699645996094,562.8779907226562,True,False,False,body
"The Centre for Humanitarian Data (‘the Centre’), together with key partners, is publishing a series of eight guidance notes on Data Responsibility in Humanitarian Action over the course of 2019 and 2020. The Guidance Note series follows the publication of the OCHA Data Responsibility Guidelines in March 2019. Through the series, the Centre aims to provide additional guidance on specific issues, processes and tools for data responsibility in practice. This series is made possible with the generous support of the Directorate-General for European Civil Protection and Humanitarian Aid Operations (DG ECHO).",10.0,True,5,65.22370147705078,592.2379760742188,False,False,False,body
