text,font_size,bold,page,x,y,is_upper,is_title_case,is_numbered,label
El seguimiento de las cuestiones y los progresos en la responsabilidad de datos a través de las estructuras de coordinación.,11.0,True,6,61.881900787353516,227.06591796875,False,False,False,body
Las organizaciones son alentadas a compartir su experiencia al promover la responsabilidad de datos en la prestación de asistencia en efectivo y mediante vales con el centro por medio de centrehumdata@un.org.,11.0,False,6,53.85430145263672,349.8381042480469,False,False,False,body
Este proyecto esta cofinanciado por la Unión Europea,7.65,False,6,53.933101654052734,718.923095703125,False,False,False,body
"El presente documento abarca las actividades de ayuda humanitaria realizadas con la ayuda financiera de la Unión Europea. Las opiniones expresadas en él no deben considerarse, en modo alguno, como la opinión oficial de la Unión Europea, y la Comisión Europea no es responsable del uso que pueda hacerse de la información que contiene.",9.0,False,6,144.95269775390625,659.3890380859375,False,False,False,body
COLABORADORES: CALP Y NORCAP/CONSEJO NORUEGO DE REFUGIADOS.,10.0,False,6,53.858299255371094,532.0905151367188,True,False,False,body
"El Centro Para Los Datos Humanitarios ('El Centro'), junto con socios importantes, está publicando una serie de notas de orientación sobre la responsabilidad de los datos en la acción humanitaria a lo largo de 2019 y 2020. La serie de notas de orientación sigue a la publicación del borrador de trabajo de las Directrices de Responsabilidad en marzo del 2019. A través de esta serie, el Centro pretende proporcionar orientación adicional sobre cuestiones, procesos y herramientasespecíficas para la responsabilidad de los datos en la práctica. Esta serie es posible gracias al generoso apoyo de la Dirección General de Protección Civil y Operaciones de Ayuda Humanitaria (DG ECHO).",10.0,True,6,64.68830108642578,558.4505004882812,False,False,False,body
>>>>>>> e445125f3f063e3282945fa7c7c637c4f1f50377
